{
  "contract": "context-candidate/v0.1",
  "contract_status": "experimental",
  "candidate_id": "cand_01JAZ6Y5M4N6KD3V8T2WQ9R7HC",
  "created_at": "2026-07-27T09:30:00Z",
  "expires_at": "2026-08-03T09:30:00Z",
  "storage_class": "local_private",
  "target": {
    "kind": "knowledge",
    "path": "wiki/concepts/context-governance.md"
  },
  "provenance": {
    "source_type": "user_statement",
    "source_ref": "conversation:phase-1b-kickoff",
    "observed_at": "2026-07-27T09:25:00Z"
  },
  "content": {
    "media_type": "text/markdown",
    "treat_as": "data",
    "text": "Candidate content remains inert until explicit review."
  }
}
