{
  "contract": "context-candidate/v0.1",
  "contract_status": "experimental",
  "candidate_id": "cand_01JAZ6Y5M4N6KD3V8T2WQ9R7HB",
  "created_at": "2026-07-27T10:00:00+08:00",
  "expires_at": null,
  "storage_class": "ephemeral",
  "target": {
    "kind": "experience",
    "path": "wiki/methods/ephemeral-candidate.md"
  },
  "provenance": {
    "source_type": "repository_document",
    "source_ref": "ephemeral:phase-1b-test",
    "observed_at": "2026-07-27T09:55:00+08:00"
  },
  "content": {
    "media_type": "text/markdown",
    "treat_as": "data",
    "text": "Ephemeral candidates cannot enter the formal Knowledge Base."
  }
}
